{
  "schema": "sentinel-controls/draft-1",
  "snapshotId": "snap-1",
  "framework": {
    "id": "express",
    "version": null
  },
  "packDigest": "sha256:6666666666666666666666666666666666666666666666666666666666666666",
  "environmentDigest": "sha256:7777777777777777777777777777777777777777777777777777777777777777",
  "registrationDigest": "sha256:8888888888888888888888888888888888888888888888888888888888888888",
  "capability": "framework-order",
  "facts": [
    {
      "id": "fact-1",
      "property": "csrf",
      "surfaceId": "web::src/server.ts::app",
      "order": 0,
      "verdict": "unknown",
      "evidence": [],
      "reasonCode": "sentinel.framework.versionUnresolved"
    }
  ],
  "frontiers": []
}
